{
  "task_context": {
    "task_id": "FRONT-PJT-CASE-05-MTG-CASE-05-01",
    "project_id": "PJT-CASE-05",
    "manager_id": "MGR-CASE-05",
    "meeting_id": "MTG-CASE-05-01",
    "evaluation_period": "2026-01-01 ~ 2026-04-21",
    "status": "collected",
    "created_at": "2026-05-05T07:58:22.639Z",
    "updated_at": "2026-05-05T07:58:22.639Z"
  },
  "meeting_id": "MTG-CASE-05-01",
  "project_id": "PJT-CASE-05",
  "manager_id": "MGR-CASE-05",
  "manager_name": "周牧",
  "input_status": {
    "readiness": "blocked",
    "missing_upstream_results": [
      "management_reviewer_result",
      "risk_behavior_auditor_result",
      "coordination_lens_result"
    ],
    "completeness_status": "degraded"
  },
  "planner_slice": {
    "focus_dimensions": [
      {
        "dimension": "方向校准力",
        "priority": "medium",
        "reasons": [
          "当前会议为阶段复盘，需要校验目标、范围和优先级是否与文档和历史决策一致。"
        ]
      },
      {
        "dimension": "推进闭环力",
        "priority": "high",
        "reasons": [
          "任务关闭率为 0.4333，需要检查遗留项是否被清楚转入下一阶段。",
          "当前会议行动项与任务表关联数量不一致，需要复核会后扩展任务或重复挂载。"
        ]
      },
      {
        "dimension": "风险治理力",
        "priority": "high",
        "reasons": [
          "风险未收口占比为 1，需要重点检查高等级风险和遗留风险治理。",
          "高等级风险收口率为 0，需要复核未收口高风险的缓释动作。"
        ]
      },
      {
        "dimension": "协同调度力",
        "priority": "medium",
        "reasons": [
          "日历、会议和通讯录样本齐备，可检查必要干系人同步与跨团队阻塞处理。"
        ]
      },
      {
        "dimension": "组织行为健康度",
        "priority": "high",
        "reasons": [
          "高压推进语言样本占比为 0.04，只生成观察项并进入人工复核。",
          "当前输入存在补录、噪音或上下文不足，组织行为判断必须降低置信度。"
        ]
      }
    ],
    "assigned_plan": {
      "agent_name": "Capability Assessor",
      "required": true,
      "input_keys": [
        "dimension_findings",
        "risk_flags",
        "hard_metrics_result",
        "human_review_items"
      ],
      "output_keys": [
        "dimension_findings",
        "risk_flags",
        "human_review_items"
      ],
      "focus_dimensions": [
        "方向校准力",
        "推进闭环力",
        "风险治理力",
        "协同调度力",
        "组织行为健康度"
      ]
    },
    "human_review_rules": [
      {
        "rule_id": "review_behavior_language_context",
        "severity": "medium",
        "reason": "组织行为相关语言只能作为观察项，需人工确认语境和场景。",
        "target_nodes": [
          "Risk & Behavior Auditor",
          "Capability Assessor"
        ]
      },
      {
        "rule_id": "review_data_quality_warnings",
        "severity": "medium",
        "reason": "前链路数据质量报告存在 warning，后续结论需要保留置信度说明。",
        "target_nodes": [
          "Capability Assessor",
          "Report Writer"
        ]
      }
    ]
  },
  "expert_results": {
    "management_reviewer_result": null,
    "risk_behavior_auditor_result": null,
    "coordination_lens_result": null
  },
  "hard_metrics": [
    {
      "metric_id": "meeting_decision_coverage_rate",
      "dimension": "方向校准力",
      "label": "会议决策留痕覆盖率",
      "value": 1,
      "numerator": 3,
      "denominator": 3,
      "unit": "ratio",
      "window": "2026-01-01 ~ 2026-04-21",
      "sample_scope": "Base Meetings decision_summary or history summary",
      "formula": {
        "formula": "value = meetings_with_decision_trace / total_meetings",
        "numerator_definition": "会议记录中 decision_summary 非空，或历史会议 summary 非空的会议数",
        "denominator_definition": "评估周期内可用会议样本总数",
        "value_rule": "ratio 保留 4 位小数；分母为 0 时 value=null 且 status=no_sample"
      },
      "calculation": {
        "expression": "3 / 3",
        "numerator": 3,
        "denominator": 3,
        "value": 1
      },
      "status": "available",
      "missing_fields": [],
      "anomalies": [],
      "evidence_refs": [
        {
          "source_type": "base_meeting",
          "source_file": "04_meetings/base_meetings_record_list.json",
          "source_id": "MTG-CASE-05-01",
          "timestamp": "2026-04-21 09:15 - 10:30",
          "evidence_label": "MTG-CASE-05-01 V1.5迭代同步会",
          "excerpt": "外观冻结本周完成 | 门锁防水方案5月5日前输出 | 成本上升15%由设计效果优先覆盖"
        },
        {
          "source_type": "base_meeting",
          "source_file": "04_meetings/base_meetings_record_list.json",
          "source_id": "MTG-CASE-05-02",
          "timestamp": "2026-04-22 10:30 - 11:45",
          "evidence_label": "MTG-CASE-05-02 供应商模具评审会",
          "excerpt": "同步调整拔模角度压缩返工周期 | 预算问题单独与财务沟通 | 林峰跟进供应商排期"
        },
        {
          "source_type": "base_meeting",
          "source_file": "04_meetings/base_meetings_record_list.json",
          "source_id": "MTG-CASE-05-03",
          "timestamp": "2026-04-24 09:00 - 09:45",
          "evidence_label": "MTG-CASE-05-03 供应链风险应急沟通",
          "excerpt": "协调供应链总监争取插队 | 同步评估供应商C打样能力 | 周牧单独跟进不占用群资源"
        }
      ]
    },
    {
      "metric_id": "task_definition_completeness_rate",
      "dimension": "推进闭环力",
      "label": "任务定义完整率",
      "value": 1,
      "numerator": 30,
      "denominator": 30,
      "unit": "ratio",
      "window": "2026-01-01 ~ 2026-04-21",
      "sample_scope": "Base Tasks: owner + DDL + task_name",
      "formula": {
        "formula": "value = tasks_with_task_name_owner_due_date / total_tasks",
        "numerator_definition": "同时具备 task_name、owner、due_date 的任务数",
        "denominator_definition": "Base Tasks 中评估周期内项目任务总数",
        "value_rule": "ratio 保留 4 位小数；缺字段任务进入 missing_fields/anomalies"
      },
      "calculation": {
        "expression": "30 / 30",
        "numerator": 30,
        "denominator": 30,
        "value": 1
      },
      "status": "available",
      "missing_fields": [],
      "anomalies": [],
      "evidence_refs": [
        {
          "source_type": "base_task",
          "source_file": "03_task_risk_register/base_tasks_record_list.json",
          "source_id": "",
          "timestamp": "2026-04-05",
          "evidence_label": "NO.501 智能音箱概念设计稿输出",
          "excerpt": "智能音箱概念设计稿输出"
        },
        {
          "source_type": "base_task",
          "source_file": "03_task_risk_register/base_tasks_record_list.json",
          "source_id": "",
          "timestamp": "2026-04-05",
          "evidence_label": "NO.502 扫地机器人概念设计稿输出",
          "excerpt": "扫地机器人概念设计稿输出"
        },
        {
          "source_type": "base_task",
          "source_file": "03_task_risk_register/base_tasks_record_list.json",
          "source_id": "",
          "timestamp": "2026-04-08",
          "evidence_label": "NO.503 智能门锁概念设计稿输出",
          "excerpt": "智能门锁概念设计稿输出"
        },
        {
          "source_type": "base_task",
          "source_file": "03_task_risk_register/base_tasks_record_list.json",
          "source_id": "",
          "timestamp": "2026-04-10",
          "evidence_label": "NO.504 概念设计评审会组织",
          "excerpt": "概念设计评审会组织"
        },
        {
          "source_type": "base_task",
          "source_file": "03_task_risk_register/base_tasks_record_list.json",
          "source_id": "",
          "timestamp": "2026-04-15",
          "evidence_label": "NO.505 品牌颜色方案调整",
          "excerpt": "品牌颜色方案调整"
        }
      ]
    },
    {
      "metric_id": "task_overdue_rate",
      "dimension": "推进闭环力",
      "label": "任务延期率",
      "value": 0,
      "numerator": 0,
      "denominator": 30,
      "unit": "ratio",
      "window": "2026-01-01 ~ 2026-04-21",
      "sample_scope": "Base Tasks with due_date",
      "formula": {
        "formula": "value = overdue_tasks / tasks_with_due_date",
        "numerator_definition": "is_overdue 为 true/yes/1/已完成/已关闭 等真值的任务数",
        "denominator_definition": "具备 due_date 的任务数",
        "value_rule": "ratio 保留 4 位小数；延期任务逐条进入 anomalies"
      },
      "calculation": {
        "expression": "0 / 30",
        "numerator": 0,
        "denominator": 30,
        "value": 0
      },
      "status": "available",
      "missing_fields": [],
      "anomalies": [],
      "evidence_refs": []
    },
    {
      "metric_id": "task_closure_rate",
      "dimension": "推进闭环力",
      "label": "任务关闭率",
      "value": 0.4333,
      "numerator": 13,
      "denominator": 30,
      "unit": "ratio",
      "window": "2026-01-01 ~ 2026-04-21",
      "sample_scope": "Base Tasks closed flag/status",
      "formula": {
        "formula": "value = closed_tasks / total_tasks",
        "numerator_definition": "is_closed 为真值，或 status 属于 已完成/done/closed/resolved 的任务数",
        "denominator_definition": "Base Tasks 中评估周期内项目任务总数",
        "value_rule": "ratio 保留 4 位小数"
      },
      "calculation": {
        "expression": "13 / 30",
        "numerator": 13,
        "denominator": 30,
        "value": 0.4333
      },
      "status": "available",
      "missing_fields": [],
      "anomalies": [],
      "evidence_refs": [
        {
          "source_type": "base_task",
          "source_file": "03_task_risk_register/base_tasks_record_list.json",
          "source_id": "",
          "timestamp": "2026-04-05",
          "evidence_label": "NO.501 智能音箱概念设计稿输出",
          "excerpt": "智能音箱概念设计稿输出 status=已完成 is_closed=true"
        },
        {
          "source_type": "base_task",
          "source_file": "03_task_risk_register/base_tasks_record_list.json",
          "source_id": "",
          "timestamp": "2026-04-05",
          "evidence_label": "NO.502 扫地机器人概念设计稿输出",
          "excerpt": "扫地机器人概念设计稿输出 status=已完成 is_closed=true"
        },
        {
          "source_type": "base_task",
          "source_file": "03_task_risk_register/base_tasks_record_list.json",
          "source_id": "",
          "timestamp": "2026-04-08",
          "evidence_label": "NO.503 智能门锁概念设计稿输出",
          "excerpt": "智能门锁概念设计稿输出 status=已完成 is_closed=true"
        },
        {
          "source_type": "base_task",
          "source_file": "03_task_risk_register/base_tasks_record_list.json",
          "source_id": "",
          "timestamp": "2026-04-10",
          "evidence_label": "NO.504 概念设计评审会组织",
          "excerpt": "概念设计评审会组织 status=已完成 is_closed=true"
        },
        {
          "source_type": "base_task",